<?xml version="1.0" encoding="UTF-8"?>

<loot:loot xmlns:loot="http://www.swordsandsorcery.com/loot"
           xmlns:xsi="http://www.w3.org/2001/XMLSchema-instance"
           xsi:schemaLocation="http://www.swordsandsorcery.com/loot ../schema.xsd">
    <loot:id>9</loot:id>
    <loot:droplist>
        <loot:drop>
            <loot:item>213</loot:item>
            <loot:amount>
                <loot:max>1</loot:max>
            </loot:amount>
            <loot:chance>3</loot:chance>
            <loot:identified>false</loot:identified>
        </loot:drop>
        <loot:drop>
            <loot:item>208</loot:item>
            <loot:amount>
                <loot:max>1</loot:max>
            </loot:amount>
            <loot:chance>0.5</loot:chance>
            <loot:identified>false</loot:identified>
        </loot:drop>
        <loot:drop>
            <loot:item>207</loot:item>
            <loot:amount>
                <loot:min>1</loot:min>
                <loot:max>2</loot:max>
            </loot:amount>
            <loot:chance>3</loot:chance>
            <loot:identified>false</loot:identified>
        </loot:drop>
        <loot:drop>
            <loot:item>210</loot:item>
            <loot:amount>
                <loot:min>1</loot:min>
                <loot:max>3</loot:max>
            </loot:amount>
            <loot:chance>6</loot:chance>
        </loot:drop>
        <loot:drop>
            <loot:item>211</loot:item>
            <loot:amount>
                <loot:max>1</loot:max>
            </loot:amount>
            <loot:chance>1</loot:chance>
        </loot:drop>
        <loot:drop>
            <loot:item>205</loot:item>
            <loot:amount>
                <loot:max>1</loot:max>
            </loot:amount>
            <loot:chance>3</loot:chance>
        </loot:drop>
        <loot:drop>
            <loot:item>203</loot:item>
            <loot:amount>
                <loot:min>1</loot:min>
                <loot:max>4</loot:max>
            </loot:amount>
            <loot:chance>100</loot:chance>
        </loot:drop>
        <loot:drop>
            <loot:item>202</loot:item>
            <loot:amount>
                <loot:max>1</loot:max>
            </loot:amount>
            <loot:chance>2</loot:chance>
        </loot:drop>
        <loot:drop>
            <loot:item>191</loot:item>
            <loot:amount>
                <loot:max>1</loot:max>
            </loot:amount>
            <loot:chance>2</loot:chance>
        </loot:drop>
        <loot:drop>
            <loot:item>188</loot:item>
            <loot:amount>
                <loot:max>1</loot:max>
            </loot:amount>
            <loot:chance>2</loot:chance>
        </loot:drop>
        <loot:drop>
            <loot:item>186</loot:item>
            <loot:amount>
                <loot:max>1</loot:max>
            </loot:amount>
            <loot:chance>2</loot:chance>
        </loot:drop>
        <loot:drop>
            <loot:item>189</loot:item>
            <loot:amount>
                <loot:min>1</loot:min>
                <loot:max>3</loot:max>
            </loot:amount>
            <loot:chance>5</loot:chance>
        </loot:drop>
        <loot:drop>
            <loot:item>165</loot:item>
            <loot:amount>
                <loot:min>1</loot:min>
                <loot:max>2</loot:max>
            </loot:amount>
            <loot:chance>5</loot:chance>
        </loot:drop>
    </loot:droplist>
</loot:loot>